{
  "schema": "qh://rwa/royalty/1.0",
  "series": "QH-R1",
  "generated_at": "2025-10-30",
  "asset": {
    "name": "Quebrada Honda I & II — Royalty Phase 1",
    "jurisdiction": "CL",
    "issuer": "Barrow Mining SpA",
    "rights": "Royalty on Net Revenue (Phase 1)",
    "concession_ids": ["QH-I", "QH-II"]
  },
  "location": { "region": "San Félix, Atacama (III), Chile", "utm": {"N": 6811610, "E": 354900}, "elev_m": 2000 },
  "ops": {
    "throughput_tpm": 20000,
    "phase_start_target": "2026-03-31",
    "payouts": { "cadence": "Quarterly", "currency": ["USDC","USD"] }
  },
  "reports": [
    { "title": "NI 43-101 Technical Report (QH I & II)", "hash_sha256": "TO_FILL", "uri": "ipfs://TO_FILL" },
    { "title": "Updated Valuation Certificate (2024-12-30)", "hash_sha256": "TO_FILL", "uri": "ipfs://TO_FILL" }
  ],
  "attachments": [
    { "title": "Company Profile (Barrow Mining SpA)", "hash_sha256": "TO_FILL", "uri": "ipfs://TO_FILL" },
    { "title": "Tramos de Inversión (Escenarios 1–4)", "hash_sha256": "TO_FILL", "uri": "ipfs://TO_FILL" },
    { "title": "Mine Presentation (QH I & II)", "hash_sha256": "TO_FILL", "uri": "ipfs://TO_FILL" }
  ]
}
